{
  "$schema": "https://json-schema.org/draft/2020-12/schema",
  "$id": "https://deepsynaps.com/schemas/qeeg_narrative.json",
  "title": "qEEG Narrative Report",
  "description": "Schema for qEEG narrative report artifacts subject to QA scoring.",
  "type": "object",
  "required": [
    "artifact_id",
    "artifact_type",
    "sections",
    "citations"
  ],
  "properties": {
    "artifact_id": {
      "type": "string",
      "minLength": 1
    },
    "artifact_type": {
      "type": "string",
      "const": "qeeg_narrative"
    },
    "content": {
      "type": "string"
    },
    "metadata": {
      "type": "object"
    },
    "sections": {
      "type": "array",
      "items": {
        "type": "object",
        "required": ["section_id"],
        "properties": {
          "section_id": { "type": "string" },
          "body": { "type": "string" }
        }
      }
    },
    "citations": {
      "type": "array",
      "items": {
        "type": "object",
        "properties": {
          "pmid": { "type": "string", "pattern": "^\\d{7,8}$" },
          "doi": { "type": "string" },
          "title": { "type": "string" },
          "authors": { "type": "string" },
          "year": { "type": ["integer", "string"] }
        }
      }
    },
    "schema_ref": {
      "type": "string"
    }
  },
  "additionalProperties": true
}
